Aplicación	Ruta del fichero	Nombre del método	Consulta
gip	gip/Web/db.vb	GetmonedaRH	select currency from xbat.comon where codmon=:codmon
gip	gip/Web/db.vb	Gettelefonodirecto	select n.id_empresa,n.num_abreviado,e.idtroqueleria,e.nombre from telefonia.numeros_abreviados n inner join sab.empresas e on n.id_empresa=e.id where n.id_empresa=:id
gip	gip/Web/db.vb	HomologarItem	DELETE FROM ELEMENTO_PROVEEDOR WHERE ID_ELEMENTO = :ELEMENTID AND = :PROVIDERID
gip	gip/Web/db.vb	HomologarItem	INSERT INTO ELEMENTO_PROVEEDOR(ID,ID_ELEMENTO,ID_EMPRESA,ID_PROVEEDOR,COMENTARIO) VALUES (ELEM_PROV_SEQ.NEXTVAL, :ELEMENTID, :EMPRESAID, :PROVIDERID, '')
gip	gip/Web/db.vb	InsertAdjunto	insert into homologaciones(homologacion, id, id_empresa, mime, nombre) values(:homologacion, SEQ_HOMOLOGACIONES.nextval, :id_empresa, :mime, :nombre)
gip	gip/Web/db.vb	InsertCorporativa	insert into prov_corp(id,nombre,cif,provincia,localidad) values (seq_prov_corp.nextval,:nombre,:cif,:provincia,:localidad)
gip	gip/Web/db.vb	InsertEmpresaCorporativa	insert into prov_corp_empresas(id_prov_corp,id_empresas) values (:id_prov_corp,:id_empresas)
gip	gip/Web/db.vb	Inserttelefonodirecto	insert into telefonia.numeros_abreviados(num_abreviado, id_empresa) values (:num_abreviado, (select id from empresas where idtroqueleria=:codpro))
gip	gip/Web/db.vb	SetPertenencia	DELETE FROM PERTENENCIA_PLANTA WHERE ID_PROVEEDOR = :PROVIDERID AND ISGLOBAL = :ISGLOBAL AND ID_PLANTA =:ID_PLANTA
gip	gip/Web/db.vb	SetPertenencia	INSERT INTO PERTENENCIA_PLANTA(ID,ID_PROVEEDOR,ISGLOBAL,ID_PLANTA) VALUES (PERTENENCIA_SEQ.NEXTVAL, :PROVIDERID, :ISGLOBAL, :ID_PLANTA)
gip	gip/Web/db.vb	UpdateEmpresaCorporativa	update PROV_CORP set nombre=:nombre, cif=:cif, provincia=:provincia, localidad=:localidad where id=:id
gip	gip/Web/db.vb	UpdatePassword	update usuarios set pwd=xbat.enkripta(:new_pwd) where idempresas=:idempresas and usuario_empresa=1
gip	gip/Web/db.vb	Updatetelefonodirecto	update telefonia.numeros_abreviados set num_abreviado=:num_abreviado where id_empresa=:id_empresa
gip	gip/Web/db.vb	borrarHomologacionesEmpresa	DELETE FROM GRUPOMATERIAL.ELEMENTO_PROVEEDOR WHERE ID_EMPRESA = :ID_EMPRESA
gip	gip/Web/db.vb	deleteAdjunto	delete homologaciones where id=:id
gip	gip/Web/db.vb	deletetelefonodirecto	delete telefonia.numeros_abreviados where id_empresa=:id_empresa
gip	gip/Web/db.vb	getElementListWithHomologationsForProvider	SELECT DISTINCT COCODE,CODESC,CFCODE,CFDESC,CSCODE,CSDESC,CECODE,CEDESC, CASE WHEN E.ID_EMPRESA IS NULL AND E.ID_PROVEEDOR IS NULL THEN 0 ELSE 1 END AS HOMOLOGADO FROM ELEMENTGM FULL OUTER JOIN SUBFAMIGM S ON CESUBF = S.CSCODE FULL OUTER JOIN FAMILIAGM F ON CSFAMI = F.CFCODE FULL OUTER JOIN COMODITY C ON CFCOMO = C.COCODE FULL OUTER JOIN ELEMENTO_PROVEEDOR E ON E.ID_ELEMENTO = CECODE AND E. = :IDPROVIDER WHERE CECODE IS NOT NULL ORDER BY COCODE,CFCODE,CSCODE,CECODE
gip	gip/Web/db.vb	getElementosHomologadosEmpresa	SELECT ID_ELEMENTO FROM GRUPOMATERIAL.ELEMENTO_PROVEEDOR WHERE ID_PROVEEDOR = 0 AND ID_EMPRESA = :ID_EMPRESA
gip	gip/Web/db.vb	getListOfRecursosUsuarioEmpresa	select a.idgrupos,a.nombre,a.url,b.idgrupos as grupo_asignado from (select gr.idgrupos, gc.nombre, r.url from gruposrecursos gr, gruposculturas gc, recursos r where gc.idgrupos = gr.idgrupos and r.id=gr.idrecursos and r.obsoleto=0 and r.tipo='E' and gc.idculturas=:idcultura and visible=1 group by gr.idgrupos, gc.nombre, r.url) a left outer join (select ug.idgrupos from usuarios u, usuariosgrupos ug where u.id=ug.idusuarios and u.idempresas=:idempresas and u.iddirectorioactivo is null and u.codpersona is null and u.usuario_empresa=1) b on a.idgrupos = b.idgrupos
gip	gip/Web/db.vb	getListOfRecursosUsuarioEmpresa	select a.idgrupos,a.nombre,a.url,b.idgrupos as grupo_asignado, ae.nombre as area from (select gr.idgrupos, gc.nombre, r.url, r.id from gruposrecursos gr, gruposculturas gc, recursos r where gc.idgrupos = gr.idgrupos and r.id=gr.idrecursos and r.obsoleto=0 and r.tipo='E' and gc.idculturas =:idcultura and visible=1 group by gr.idgrupos, gc.nombre, r.url,r.id) a left outer join (select ug.idgrupos from usuarios u, usuariosgrupos ug where u.id=ug.idusuarios and u.idempresas=:idempresas and u.iddirectorioactivo is null and u.codpersona is null and u.usuario_empresa=1) b on a.idgrupos = b.idgrupos left outer join AREAS_EXTRANET_RECURSOS ar on ar.id_recurso = a.id left outer join areas_extranet ae on ae.id=ar.id_area
gip	gip/Web/db.vb	getPlantasConPertenencia	SELECT P.ID,P.NOMBRE,NVL(PP.ID,0) FROM SAB.PLANTAS P LEFT OUTER JOIN PERTENENCIA_PLANTA PP ON P.ID = PP.ID_PLANTA AND PP.ID_PROVEEDOR = :IDPROV AND PP.ISGLOBAL = :ISGLOBAL WHERE P.OBSOLETO = 0
gip	gip/Web/db.vb	getProviderName	SELECT NOMBRE FROM EMPRESAS WHERE ID = :IDPROVIDER
gip	gip/Web/db.vb	getProviderName	SELECT NOMBRE FROM PROV_CORP WHERE ID = :IDPROVIDER
gip	gip/Web/db.vb	getTipoProveedorSistemas	select liliar from X500PRDSD.lief where lilinr=? and lifirm=cast(? as varchar(255))
gip	gip/Web/db.vb	homologarElementosProveedor	INSERT INTO GRUPOMATERIAL.ELEMENTO_PROVEEDOR(ID,ID_ELEMENTO,ID_EMPRESA,ID_PROVEEDOR,COMENTARIO) VALUES(GRUPOMATERIAL.ELEM_PROV_SEQ.NEXTVAL,:ID_ELEMENT,0,:ID_PROVIDER,'')
gip	gip/Web/db.vb	updateNotificado	update empresas set notificado=:notificado where id=:id
navsilon	navsilon/web/DAL/db.vb	AddAplicacion	insert into aplicacion(nombre) values(@nombre)
navsilon	navsilon/web/DAL/db.vb	AddAsiento	insert into asiento(id_aplicacion,nombre) values(@id_aplicacion,@nombre);SELECT CAST(scope_identity() AS int)
navsilon	navsilon/web/DAL/db.vb	AddCuenta	insert into cuenta(id_tipo_cuenta,nombre,descripcion, lantegi) values(@id_tipo_cuenta,@nombre,@descripcion, @lantegi)
navsilon	navsilon/web/DAL/db.vb	AddCuentaDepartamento	insert into departamento_cuenta(id_cuenta,id_departamento) values(@id_cuenta,@id_departamento)
navsilon	navsilon/web/DAL/db.vb	AddDepartamentoAdministracion	insert into departamento(id_negocio,id_mano_obra,nombre,lantegi) values(@id_negocio,@id_mano_obra,@nombre,@lantegi)
navsilon	navsilon/web/DAL/db.vb	AddManoObraAdministracion	insert into mano_obra(nombre) values(@nombre)
navsilon	navsilon/web/DAL/db.vb	AddNegocioAdministracion	insert into negocio(nombre) values(@nombre)
navsilon	navsilon/web/DAL/db.vb	AddTipoCuenta	insert into tipo_cuenta(id_aplicacion,nombre) values(@id_aplicacion,@nombre)
navsilon	navsilon/web/DAL/db.vb	AddTipoCuentaAAsiento	insert into asiento_tipo_cuenta(id_asiento, id_tipo_cuenta, suma_resta) values(@id_asiento, @id_tipo_cuenta, @suma_resta)
navsilon	navsilon/web/DAL/db.vb	AddTipoCuentaColumna	insert into tipo_cuenta_columna(id_tipo_cuenta, id_columna) values(@id_tipo_cuenta, @id_columna)
navsilon	navsilon/web/DAL/db.vb	EditCuenta	update cuenta set nombre=@nombre,descripcion=@descripcion, lantegi=@lantegi where id=@id
navsilon	navsilon/web/DAL/db.vb	EditDepartamentoAdministracion	update departamento set nombre=@nombre,lantegi=@lantegi, fecha_baja=@fecha_baja where id_negocio=@id_negocio and id_mano_obra=@id_mano_obra and id=@id
navsilon	navsilon/web/DAL/db.vb	GetAsiento	select y.d_columna,sum(case when y.id_operacion=1 then y.devengo when y.id_operacion=0 then 0 else -y.devengo end) as devengo,y.id_operacion_col,y.id_nivel from (select devengo.d_con,sum(devengo.devengo) as devengo,devengo.id_operacion,devengo.id_operacion_col,devengo.d_columna,devengo.id_columna,t.id_nivel from (select c.id_des,c.d_con,d.id_trabajador,d.devengo,cc.id_operacion,d.id_secuencia,co.id_operacion as id_operacion_col,co.d_columna,cc.id_columna from devengos d, at_concepto ac, des_concepto c, con_columna cc, mst_calculos mc, columnas co where d.id_par=ac.id_par and d.id_concepto=ac.id_concepto and ac.id_des=c.id_des and co.id_resumen=cc.id_resumen and co.id_columna=cc.id_columna and d.ejercicio=mc.ejercicio and d.mes=mc.mes and d.id_empresa=mc.id_empresa and d.id_trabajador = mc.id_trabajador And d.id_secuencia = mc.id_secuencia and cc.id_par=d.id_par and cc.id_concepto=d.id_concepto and cc.id_resumen='11' and ((mc.f_devengo<=@fecha_max and mc.f_devengo>=@fecha_min and mc.mes_nat<>13 and mc.mes_nat<>14) ) and d.ejercicio=@ejercicio and d.id_empresa='00001' ) devengo, (select id_trabajador,id_secuencia,no.d_nivel,no.id_nivel from pues_trab b1, orden b2, niv_org no where b1.id_nivel=b2.id_nivel_hijo and b1.id_organig=b2.id_organig and no.id_nivel=b2.n4 and b1.f_ini_pue<=@fecha_max and (b1.f_fin_pue>=@fecha_min or b1.f_fin_pue is null) and b1.id_organig='00001' and no.id_organig= b1.id_organig) t where t.id_trabajador=devengo.id_trabajador and t.id_secuencia=devengo.id_secuencia group by devengo.id_des,devengo.d_con,devengo.id_operacion,devengo.id_operacion_col,devengo.d_columna,devengo.id_columna,t.id_nivel) y group by y.id_operacion_col,y.d_columna,y.id_columna,y.id_nivel
navsilon	navsilon/web/DAL/db.vb	GetAsiento	select y.d_columna,sum(case when y.id_operacion=1 then y.devengo when y.id_operacion=0 then 0 else -y.devengo end) as devengo,y.id_operacion_col,y.id_nivel from (select devengo.d_con,sum(devengo.devengo) as devengo,devengo.id_operacion,devengo.id_operacion_col,devengo.d_columna,devengo.id_columna,t.id_nivel from (select c.id_des,c.d_con,d.id_trabajador,d.devengo,cc.id_operacion,d.id_secuencia,co.id_operacion as id_operacion_col,co.d_columna,cc.id_columna from devengos d, at_concepto ac, des_concepto c, con_columna cc, mst_calculos mc, columnas co where d.id_par=ac.id_par and d.id_concepto=ac.id_concepto and ac.id_des=c.id_des and co.id_resumen=cc.id_resumen and co.id_columna=cc.id_columna and d.ejercicio=mc.ejercicio and d.mes=mc.mes and d.id_empresa=mc.id_empresa and d.id_trabajador = mc.id_trabajador And d.id_secuencia = mc.id_secuencia and cc.id_par=d.id_par and cc.id_concepto=d.id_concepto and cc.id_resumen=@resumen and ((mc.f_devengo<=@fecha_max and mc.f_devengo>=@fecha_min and mc.mes_nat<>13 and mc.mes_nat<>14) ) and d.ejercicio=@ejercicio and d.id_empresa='00001' ) devengo, (select t.id_trabajador,t.id_secuencia,no.d_nivel,no.id_nivel from pues_trab b1, trabajadores t, orden b2, niv_org no where t.id_convenio=@id_convenio and b1.id_nivel=b2.id_nivel_hijo and b1.id_organig=b2.id_organig and no.id_nivel=b2.n4 and b1.f_ini_pue<=@fecha_max and (b1.f_fin_pue>=@fecha_min or b1.f_fin_pue is null) and b1.id_organig='00001' and no.id_organig= b1.id_organig and t.id_trabajador=b1.id_trabajador and t.id_empresa=b1.id_empresa and t.id_secuencia=b1.id_secuencia) t where t.id_trabajador=devengo.id_trabajador and t.id_secuencia=devengo.id_secuencia group by devengo.id_des,devengo.d_con,devengo.id_operacion,devengo.id_operacion_col,devengo.d_columna,devengo.id_columna,t.id_nivel) y group by y.id_operacion_col,y.d_columna,y.id_columna,y.id_nivel
navsilon	navsilon/web/DAL/db.vb	GetAsiento11	select y.d_columna,sum(case when y.id_operacion=1 then y.devengo when y.id_operacion=0 then 0 else -y.devengo end) as devengo,y.id_operacion_col,y.id_nivel from (select devengo.d_con,sum(devengo.devengo) as devengo,devengo.id_operacion,devengo.id_operacion_col,devengo.d_columna,devengo.id_columna,t.id_nivel from (select c.id_des,c.d_con,d.id_trabajador,d.devengo,cc.id_operacion,d.id_secuencia,co.id_operacion as id_operacion_col,co.d_columna,cc.id_columna from devengos d, at_concepto ac, des_concepto c, con_columna cc, mst_calculos mc, columnas co where d.id_par=ac.id_par and d.id_concepto=ac.id_concepto and ac.id_des=c.id_des and co.id_resumen=cc.id_resumen and co.id_columna=cc.id_columna and d.ejercicio=mc.ejercicio and d.mes=mc.mes and d.id_empresa=mc.id_empresa and d.id_trabajador = mc.id_trabajador And d.id_secuencia = mc.id_secuencia and cc.id_par=d.id_par and cc.id_concepto=d.id_concepto and cc.id_resumen='11' and ((mc.f_devengo<=@fecha_max and mc.f_devengo>=@fecha_min and mc.mes_nat<>13 and mc.mes_nat<>14) ) and d.ejercicio=@ejercicio and d.id_empresa='00001' ) devengo, (select id_trabajador,id_secuencia,no.d_nivel,no.id_nivel from pues_trab b1, orden b2, niv_org no where b1.id_nivel=b2.id_nivel_hijo and b1.id_organig=b2.id_organig and no.id_nivel=b2.n4 and b1.f_ini_pue<=@fecha_max and (b1.f_fin_pue>=@fecha_min or b1.f_fin_pue is null) and b1.id_organig='00001' and no.id_organig= b1.id_organig) t where t.id_trabajador=devengo.id_trabajador and t.id_secuencia=devengo.id_secuencia group by devengo.id_des,devengo.d_con,devengo.id_operacion,devengo.id_operacion_col,devengo.d_columna,devengo.id_columna,t.id_nivel) y group by y.id_operacion_col,y.d_columna,y.id_columna,y.id_nivel
navsilon	navsilon/web/DAL/db.vb	GetAsiento11	select y.d_columna,sum(case when y.id_operacion=1 then y.devengo when y.id_operacion=0 then 0 else -y.devengo end) as devengo,y.id_operacion_col,y.id_nivel from (select devengo.d_con,sum(devengo.devengo) as devengo,devengo.id_operacion,devengo.id_operacion_col,devengo.d_columna,devengo.id_columna,t.id_nivel from (select c.id_des,c.d_con,d.id_trabajador,d.devengo,cc.id_operacion,d.id_secuencia,co.id_operacion as id_operacion_col,co.d_columna,cc.id_columna from devengos d, at_concepto ac, des_concepto c, con_columna cc, mst_calculos mc, columnas co where d.id_par=ac.id_par and d.id_concepto=ac.id_concepto and ac.id_des=c.id_des and co.id_resumen=cc.id_resumen and co.id_columna=cc.id_columna and d.ejercicio=mc.ejercicio and d.mes=mc.mes and d.id_empresa=mc.id_empresa and d.id_trabajador = mc.id_trabajador And d.id_secuencia = mc.id_secuencia and cc.id_par=d.id_par and cc.id_concepto=d.id_concepto and cc.id_resumen='11' and ((mc.f_devengo<=@fecha_max and mc.f_devengo>=@fecha_min and mc.mes_nat<>13 and mc.mes_nat<>14) ) and d.ejercicio=@ejercicio and d.id_empresa='00001' ) devengo, (select t.id_trabajador,t.id_secuencia,no.d_nivel,no.id_nivel from pues_trab b1, trabajadores t, orden b2, niv_org no where t.id_convenio=@id_convenio and b1.id_nivel=b2.id_nivel_hijo and b1.id_organig=b2.id_organig and no.id_nivel=b2.n4 and b1.f_ini_pue<=@fecha_max and (b1.f_fin_pue>=@fecha_min or b1.f_fin_pue is null) and b1.id_organig='00001' and no.id_organig= b1.id_organig and t.id_trabajador=b1.id_trabajador and t.id_empresa=b1.id_empresa and t.id_secuencia=b1.id_secuencia) t where t.id_trabajador=devengo.id_trabajador and t.id_secuencia=devengo.id_secuencia group by devengo.id_des,devengo.d_con,devengo.id_operacion,devengo.id_operacion_col,devengo.d_columna,devengo.id_columna,t.id_nivel) y group by y.id_operacion_col,y.d_columna,y.id_columna,y.id_nivel
navsilon	navsilon/web/DAL/db.vb	GetAsiento13	select y.d_columna,sum(case when y.id_operacion=1 then y.devengo when y.id_operacion=0 then 0 else -y.devengo end) as devengo,y.id_operacion_col,y.id_nivel from (select devengo.d_con,sum(devengo.devengo) as devengo,devengo.id_operacion,devengo.id_operacion_col,devengo.d_columna,devengo.id_columna,t.id_nivel from (select c.id_des,c.d_con,d.id_trabajador,d.devengo,cc.id_operacion,d.id_secuencia,co.id_operacion as id_operacion_col,co.d_columna,cc.id_columna from devengos d, at_concepto ac, des_concepto c, con_columna cc, mst_calculos mc, columnas co where d.id_par=ac.id_par and d.id_concepto=ac.id_concepto and ac.id_des=c.id_des and co.id_resumen=cc.id_resumen and co.id_columna=cc.id_columna and d.ejercicio=mc.ejercicio and d.mes=mc.mes and d.id_empresa=mc.id_empresa and d.id_trabajador = mc.id_trabajador And d.id_secuencia = mc.id_secuencia and cc.id_par=d.id_par and cc.id_concepto=d.id_concepto and cc.id_resumen='11' and ((mc.f_devengo<=@fecha_max and mc.f_devengo>=@fecha_min and mc.mes_nat<>13 and mc.mes_nat<>14) ) and d.ejercicio=@ejercicio and d.id_empresa='00001' ) devengo, (select id_trabajador,id_secuencia,no.d_nivel,no.id_nivel from pues_trab b1, orden b2, niv_org no where b1.id_nivel=b2.id_nivel_hijo and b1.id_organig=b2.id_organig and no.id_nivel=b2.n4 and b1.f_ini_pue<=@fecha_max and (b1.f_fin_pue>=@fecha_min or b1.f_fin_pue is null) and b1.id_organig='00001' and no.id_organig= b1.id_organig) t where t.id_trabajador=devengo.id_trabajador and t.id_secuencia=devengo.id_secuencia group by devengo.id_des,devengo.d_con,devengo.id_operacion,devengo.id_operacion_col,devengo.d_columna,devengo.id_columna,t.id_nivel) y group by y.id_operacion_col,y.d_columna,y.id_columna,y.id_nivel
navsilon	navsilon/web/DAL/db.vb	GetAsiento13	select y.d_columna,sum(case when y.id_operacion=1 then y.devengo when y.id_operacion=0 then 0 else -y.devengo end) as devengo,y.id_operacion_col,y.id_nivel from (select devengo.d_con,sum(devengo.devengo) as devengo,devengo.id_operacion,devengo.id_operacion_col,devengo.d_columna,devengo.id_columna,t.id_nivel from (select c.id_des,c.d_con,d.id_trabajador,d.devengo,cc.id_operacion,d.id_secuencia,co.id_operacion as id_operacion_col,co.d_columna,cc.id_columna from devengos d, at_concepto ac, des_concepto c, con_columna cc, mst_calculos mc, columnas co where d.id_par=ac.id_par and d.id_concepto=ac.id_concepto and ac.id_des=c.id_des and co.id_resumen=cc.id_resumen and co.id_columna=cc.id_columna and d.ejercicio=mc.ejercicio and d.mes=mc.mes and d.id_empresa=mc.id_empresa and d.id_trabajador = mc.id_trabajador And d.id_secuencia = mc.id_secuencia and cc.id_par=d.id_par and cc.id_concepto=d.id_concepto and cc.id_resumen='13' and ((mc.f_devengo<=@fecha_max and mc.f_devengo>=@fecha_min and mc.mes_nat<>13 and mc.mes_nat<>14) ) and d.ejercicio=@ejercicio and d.id_empresa='00001' ) devengo, (select t.id_trabajador,t.id_secuencia,no.d_nivel,no.id_nivel from pues_trab b1, trabajadores t, orden b2, niv_org no where t.id_convenio=@id_convenio and b1.id_nivel=b2.id_nivel_hijo and b1.id_organig=b2.id_organig and no.id_nivel=b2.n4 and b1.f_ini_pue<=@fecha_max and (b1.f_fin_pue>=@fecha_min or b1.f_fin_pue is null) and b1.id_organig='00001' and no.id_organig= b1.id_organig and t.id_trabajador=b1.id_trabajador and t.id_empresa=b1.id_empresa and t.id_secuencia=b1.id_secuencia) t where t.id_trabajador=devengo.id_trabajador and t.id_secuencia=devengo.id_secuencia group by devengo.id_des,devengo.d_con,devengo.id_operacion,devengo.id_operacion_col,devengo.d_columna,devengo.id_columna,t.id_nivel) y group by y.id_operacion_col,y.d_columna,y.id_columna,y.id_nivel
navsilon	navsilon/web/DAL/db.vb	GetCuenta	select id,nombre,descripcion, lantegi from cuenta where id=@id
navsilon	navsilon/web/DAL/db.vb	GetCuentasTraspaso	select c.nombre, c.descripcion,d.lantegi, atc.suma_resta, atc.id_asiento,c.id,a.nombre,c.lantegi from cuenta c, asiento_tipo_cuenta atc,departamento_cuenta dp, epsilon_contabilidad ec, tipo_cuenta_columna tcc, departamento d, tipo_cuenta tc, asiento a where c.id_tipo_cuenta = atc.id_tipo_cuenta And dp.id_cuenta = c.id And ec.id_departamento = dp.id_departamento And tcc.id_tipo_cuenta = c.id_tipo_cuenta And d.id = dp.id_departamento And tc.id = c.id_tipo_cuenta and a.id=atc.id_asiento and a.id_aplicacion=tc.id_aplicacion and tc.id_aplicacion=@id_aplicacion and tcc.id_columna=@id_columna and ec.id_epsilon=@id_epsilon group by c.nombre, c.descripcion,d.lantegi, atc.suma_resta, atc.id_asiento,c.id,a.nombre,c.lantegi
navsilon	navsilon/web/DAL/db.vb	GetDepartamentosAdministracion	select id,nombre,lantegi,fecha_baja from departamento where id=@id
navsilon	navsilon/web/DAL/db.vb	GetEvolucionPlantilla	select f_ini_pue,f_fin_pue,ca.d_categoria,co.d_convenio,p.sexo,n4.d_nivel,n2.d_nivel from trabajadores t inner join categorias ca on t.id_categoria=ca.id_categoria and ca.id_convenio=t.id_convenio inner join convenios co on co.id_convenio=t.Id_convenio inner join cod_tra ct on ct.id_trabajador=t.id_trabajador and t.id_empresa=ct.id_empresa inner join personas p on p.nif=ct.nif inner join pues_trab pt on t.id_trabajador=pt.id_trabajador and t.id_empresa=pt.id_empresa and t.id_secuencia=pt.id_secuencia inner join orden o on pt.id_organig=o.id_organig and pt.id_nivel=o.id_nivel_hijo inner join niv_org n2 on n2.id_organig=o.id_organig and n2.id_nivel=o.n2 inner join niv_org n4 on n4.id_organig=o.id_organig and n4.id_nivel=o.n4 where f_ini_pue<@f_max and (f_fin_pue>=@f_min or f_fin_pue is null) and t.id_empresa='00001' and pt.id_organig='00001'
navsilon	navsilon/web/DAL/db.vb	GetListOfAplicacion	select id,nombre from aplicacion
navsilon	navsilon/web/DAL/db.vb	GetListOfAsiento	select id,nombre from asiento where id_aplicacion=@id_aplicacion
navsilon	navsilon/web/DAL/db.vb	GetListOfCuenta	select id,nombre,descripcion,lantegi from cuenta where id_tipo_cuenta=@id_tipo_cuenta
navsilon	navsilon/web/DAL/db.vb	GetListOfCuentasDepartamentos	select dc.id_cuenta,dc.id_departamento,d.nombre,c.nombre,tc.id,tc.nombre,c.descripcion, c.lantegi from departamento_cuenta dc, departamento d, cuenta c, tipo_cuenta tc where dc.id_departamento=d.id and c.id_tipo_cuenta=tc.id and dc.id_cuenta=c.id and d.fecha_baja is null
navsilon	navsilon/web/DAL/db.vb	GetListOfDepartamentosAdministracion	select id,nombre, lantegi, fecha_baja from departamento where id_negocio=@id_negocio and id_mano_obra=@id_mano_obra
navsilon	navsilon/web/DAL/db.vb	GetListOfDepartamentosEpsilon	select n.id_nivel,n.d_nivel from pues_trab pt, orden o, niv_org n where pt.id_organig=o.id_organig and pt.id_nivel=o.id_nivel_hijo and o.n4=n.id_nivel and o.id_organig=n.id_organig and pt.id_organig='00001' and (pt.f_fin_pue is null or pt.f_fin_pue>=getdate()) and pt.id_empresa='00001' group by n.id_nivel,n.d_nivel order by n.d_nivel
navsilon	navsilon/web/DAL/db.vb	GetListOfManoObraAdministracion	select id,nombre from mano_obra
navsilon	navsilon/web/DAL/db.vb	GetListOfNegocioAdministracion	select id,nombre from negocio
navsilon	navsilon/web/DAL/db.vb	GetListOfTipoCuenta	select tc.id,nombre,coalesce(b.sin_asignar ,0) from tipo_cuenta tc left outer join (select count(*) as sin_asignar, tc.id from cuenta c, tipo_cuenta tc where c.id_tipo_cuenta = tc.id And Not exists (select * from tipo_cuenta tc2, cuenta c2, departamento_cuenta dc2, departamento d2 where tc2.id=c2.id_tipo_cuenta and c2.id=dc2.id_cuenta and c2.id=c.id and d2.id=dc2.id_departamento and d2.fecha_baja is null) group by tc.id) b on tc.id=b.id where tc.id_aplicacion=@id_aplicacion
navsilon	navsilon/web/DAL/db.vb	GetListOfTipoCuentaConColumnas	select tc.id,tc.nombre,tcc.id_columna from tipo_cuenta tc left outer join tipo_cuenta_columna tcc on tc.id=tcc.id_tipo_cuenta where id_aplicacion=@id_aplicacion
navsilon	navsilon/web/DAL/db.vb	GetListOfTipoCuentaEnAsiento	select tc.id,tc.nombre,atc.suma_resta from tipo_cuenta tc, asiento_tipo_cuenta atc where tc.id_aplicacion=@id_aplicacion and atc.id_tipo_cuenta=tc.id and id_asiento=@id_asiento
navsilon	navsilon/web/DAL/db.vb	GetListOfTipoCuentaNoEnAsiento	select id,nombre from tipo_cuenta tp where tp.id_aplicacion=@id_aplicacion and not exists(select * from asiento_tipo_cuenta atc where atc.id_tipo_cuenta=tp.id and id_asiento=@id_asiento)
navsilon	navsilon/web/DAL/db.vb	GetListOfcolumnas	select id_columna,d_columna,id_operacion from columnas where id_resumen=@id_resumen
navsilon	navsilon/web/DAL/db.vb	GetMapeosEpsilonAdministracion	select id_epsilon, id_departamento,fecha_baja from epsilon_contabilidad ep, departamento d where ep.id_departamento=d.id
navsilon	navsilon/web/DAL/db.vb	GetNumeroDeAsignacionesTeoricas	select count(*) * (select count(*) from departamento) from aplicacion a, tipo_cuenta tp where a.id=tp.id_aplicacion
navsilon	navsilon/web/DAL/db.vb	GetNumeroPersonas	select count(*) from pues_trab pt, orden o where pt.id_nivel=o.id_nivel_hijo and pt.id_organig=o.id_organig and pt.id_organig='00001' and pt.id_empresa='00001' and pt.f_ini_pue<=getdate() and (f_fin_pue>= getdate() or f_fin_pue is null) and o.n4=@departamento
navsilon	navsilon/web/DAL/db.vb	GetTiposNomina	select t.d_nomina, t.id_nomina from mst_calculos c inner join .TIP_NOMINAS t on t.id_nomina=c.id_nomina where c.f_devengo<=@f_max and c.f_devengo>=@f_min group by t.d_nomina, t.id_nomina
navsilon	navsilon/web/DAL/db.vb	GetTiposNomina	select t.d_nomina, t.id_nomina from mst_calculos c inner join .TIP_NOMINAS t on t.id_nomina=c.id_nomina where c.mes_nat=13 and ejercicio=@ejercicio group by t.d_nomina, t.id_nomina
navsilon	navsilon/web/DAL/db.vb	GetTiposNomina	select t.d_nomina, t.id_nomina from mst_calculos c inner join .TIP_NOMINAS t on t.id_nomina=c.id_nomina where c.mes_nat=14 and ejercicio=@ejercicio group by t.d_nomina, t.id_nomina
navsilon	navsilon/web/DAL/db.vb	GetUsuario	select u.id from sab.usuarios u inner join sab.usuariosgrupos ug on u.id=ug.idusuarios, sab.gruposrecursos gr where u.iddirectorioactivo=:iddirectorioactivo and (u.fechabaja is null or fechabaja>sysdate) and ug.idgrupos=gr.idgrupos and gr.idrecursos=:idrecurso
navsilon	navsilon/web/DAL/db.vb	RemoveCuentaDepartamento	delete departamento_cuenta where id_cuenta=@id_cuenta and id_departamento=@id_departamento
navsilon	navsilon/web/DAL/db.vb	RemoveTipoCuentaAAsiento	delete from asiento_tipo_cuenta where id_asiento=@id_asiento and id_tipo_cuenta=@id_tipo_cuenta
navsilon	navsilon/web/DAL/db.vb	RemoveTipoCuentaColumna	delete tipo_cuenta_columna where id_tipo_cuenta=@id_tipo_cuenta and id_columna=@id_columna
navsilon	navsilon/web/DAL/db.vb	TraspasarAsientoANavision	insert into [Batz S_ Coop_$Mov_ Diario]([No_ Mov],[Fecha Registro], [Tipo Traspaso],[No_ Documento],[No_ Cuenta],Descripcion,[Importe Debe],[Importe Haber], [Dimension Proyecto],[Dimension Lantegi], [Fecha Traspaso NAV], [Fecha Traspaso Diario], Tipo, [Tipo Contrapartida], [Cuenta Contrapartida],[Journal Template Name],[Journal Line No_],[Journal Batch Name]) select @No_Mov,(SELECT DATEADD(dd, 0, DATEDIFF(dd, 0, @Fecha_Registro))),1,@No_Documento,@No_Cuenta,@Descripcion,@Importe_Debe,@Importe_Haber,'',@Dimension_Lantegi,(SELECT DATEADD(dd, 0, DATEDIFF(dd, 0, GETDATE()))),(select cast('1753-1-1' as datetime)),'','','','','',''
navsilon	navsilon/web/DAL/db.vb	getAplicacionFromTipoCuenta	select id_aplicacion from tipo_cuenta where id=@id
salmentafakturazioa	(sin fichero con SQL de Navision detectado)	(sin método)	(sin consulta SQL detectada)
